<?xml version="1.0" encoding="UTF-8"?>
<!DOCTYPE menu SYSTEM "menu.dtd">
<menu>

    <item>
        <nombre>Mazamorra</nombre>
        <precio moneda="EUR">8.50</precio>
        <tipo>Entrante</tipo>
        <categoria>Crema</categoria>
    </item>

    <item>
        <nombre>Ensalada Jerk</nombre>
        <precio moneda="EUR">12.00</precio>
        <tipo>Primer Plato</tipo>
        <categoria>Ensalada</categoria>
    </item>

    <item>
        <nombre>Fabada</nombre>
        <precio moneda="EUR">17.00</precio>
        <tipo>Segundo Plato</tipo>
        <categoria>Guiso</categoria>
    </item>

    <item>
        <nombre>Helado matcha</nombre>
        <precio moneda="EUR">4.00</precio>
        <tipo>Postre</tipo>
        <categoria>Postre</categoria>
    </item>
</menu>